{
  "vectorId": "cv_14_relay_timestamp_future",
  "version": "1.0.0",
  "category": "relay_timestamp",
  "description": "Relay timestamp set 7200 seconds (2 hours) in the future beyond block.timestamp tolerance. This could indicate a manipulation attempt where the prover tries to extend the effective TTL of a root by backdating the relay. A conformant verifier MUST reject timestamps that exceed the future tolerance.",
  "sourceChainId": 1,
  "targetChainId": 137,
  "relayTimestamp": 1713348000,
  "rootAge": 0,
  "maxRootAge": 3600,
  "proof": "0xa4b8c2d1e5f9a3b7c6d0e4f8a2b1c5d9e3f7a6b0c4d8e2f1a5b9c3d7e6f0a4b8c2d1e5f9a3b7c6d0e4f8a2b1c5d9e3f7a6b0c4d8e2f1a5b9c3d7e6f0a4b8c2d1e5f9a3b7c6d0e4f8a2b1c5d9e3f7a6b0c4d8e2f1a5b9c3d7e6f0a4b8c2d1e5f9a3b7c6d0e4f8a2b",
  "publicInputs": [
    "0x7b8c9d0e1f2a3b4c5d6e7f8a9b0c1d2e3f4a5b6c7d8e9f0a1b2c3d4e5f6a7b",
    "0x0000000000000000000000000000000000000000000000000000000099887766",
    "0x0000000000000000000000000000000000000000000000000000000000000089"
  ],
  "expectedResult": "fail",
  "failureReason": "RELAY_TIMESTAMP_FUTURE",
  "metadata": {
    "author": "bolyra-conformance",
    "createdAt": "2026-04-17",
    "protocolVersion": "0.5.0",
    "notes": "relayTimestamp=1713348000 is ~2h ahead of the expected block.timestamp ~1713340800. Verifiers should enforce a future tolerance (e.g., 900 seconds / 15 minutes). The test harness should set the mock block.timestamp to 1713340800."
  }
}
