{
  "vectorId": "cv_13_nullifier_cross_chain_scoped_valid",
  "version": "1.0.0",
  "category": "nullifier_replay",
  "description": "Distinct nullifier used on Polygon (chainId=137) after a valid use of a different nullifier on Ethereum (chainId=1). With chain-scoped nullifier sets, each chain maintains its own nullifier registry. A fresh nullifier on a new chain should be accepted.",
  "sourceChainId": 137,
  "targetChainId": 137,
  "relayTimestamp": 1713341600,
  "rootAge": 90,
  "maxRootAge": 3600,
  "proof": "0x9a3b7c6d0e4f8a2b1c5d9e3f7a6b0c4d8e2f1a5b9c3d7e6f0a4b8c2d1e5f9a3b7c6d0e4f8a2b1c5d9e3f7a6b0c4d8e2f1a5b9c3d7e6f0a4b8c2d1e5f9a3b7c6d0e4f8a2b1c5d9e3f7a6b0c4d8e2f1a5b9c3d7e6f0a4b8c2d1e5f9a3b7c6d0e4f8a2b1c5d9e3f7a6b",
  "publicInputs": [
    "0x6a7b8c9d0e1f2a3b4c5d6e7f8a9b0c1d2e3f4a5b6c7d8e9f0a1b2c3d4e5f6a",
    "0x00000000000000000000000000000000000000000000000000000000cafe1337",
    "0x0000000000000000000000000000000000000000000000000000000000000089"
  ],
  "expectedResult": "pass",
  "failureReason": null,
  "nullifier": {
    "nullifierHash": "0xfedcba9876543210fedcba9876543210fedcba9876543210fedcba9876543210",
    "scope": "chain_scoped",
    "priorUsageChainId": null
  },
  "metadata": {
    "author": "bolyra-conformance",
    "createdAt": "2026-04-17",
    "protocolVersion": "0.5.0",
    "notes": "Different nullifier hash from cv_11/cv_12. Chain-scoped nullifier set means Polygon's registry is independent. This is a valid first-use on chain 137."
  }
}
